"No.","Time","Source","Destination","Protocol","Length","Info"
"1","0.000000","104.19.132.78","192.168.1.12","TLSv1.2","1445","Application Data"
"2","0.000000","104.19.132.78","192.168.1.12","TLSv1.2","1441","Application Data"
"3","0.000000","104.19.132.78","192.168.1.12","TLSv1.2","85","Application Data"
"4","0.000350","192.168.1.12","104.19.132.78","TCP","54","53685  >  443 [ACK] Seq=1 Ack=2810 Win=257 Len=0"
"7","0.059155","192.168.1.12","13.35.13.10","TCP","66","53704  >  443 [SYN] Seq=0 Win=64240 Len=0 MSS=1460 WS=256 SACK_PERM=1"
"8","0.088210","13.35.13.10","192.168.1.12","TCP","66","443  >  53704 [SYN, ACK] Seq=0 Ack=1 Win=29200 Len=0 MSS=1452 SACK_PERM=1 WS=256"
"9","0.088638","192.168.1.12","13.35.13.10","TCP","54","53704  >  443 [ACK] Seq=1 Ack=1 Win=66560 Len=0"
"12","0.098338","192.168.1.12","13.227.241.28","TCP","66","53705  >  443 [SYN] Seq=0 Win=64240 Len=0 MSS=1460 WS=256 SACK_PERM=1"
"13","0.109695","192.168.1.12","13.35.13.10","TLSv1.3","571","Client Hello"
"14","0.115249","13.227.241.28","192.168.1.12","TCP","66","443  >  53705 [SYN, ACK] Seq=0 Ack=1 Win=29200 Len=0 MSS=1452 SACK_PERM=1 WS=256"
"15","0.115528","192.168.1.12","13.227.241.28","TCP","54","53705  >  443 [ACK] Seq=1 Ack=1 Win=66560 Len=0"
"16","0.125590","192.168.1.12","13.227.241.28","TLSv1.3","571","Client Hello"
"17","0.130159","13.35.13.10","192.168.1.12","TCP","54","443  >  53704 [ACK] Seq=1 Ack=518 Win=30464 Len=0"
"18","0.131168","13.35.13.10","192.168.1.12","TLSv1.3","1504","Server Hello, Change Cipher Spec, Application Data"
"19","0.131168","13.35.13.10","192.168.1.12","TCP","1504","443  >  53704 [ACK] Seq=1451 Ack=518 Win=30464 Len=1450 [TCP segment of a reassembled PDU]"
"20","0.131503","192.168.1.12","13.35.13.10","TCP","54","53704  >  443 [ACK] Seq=518 Ack=2901 Win=66560 Len=0"
"21","0.132099","13.35.13.10","192.168.1.12","TCP","1504","443  >  53704 [ACK] Seq=2901 Ack=518 Win=30464 Len=1450 [TCP segment of a reassembled PDU]"
"22","0.132099","13.35.13.10","192.168.1.12","TCP","1504","443  >  53704 [ACK] Seq=4351 Ack=518 Win=30464 Len=1450 [TCP segment of a reassembled PDU]"
"23","0.132331","192.168.1.12","13.35.13.10","TCP","54","53704  >  443 [ACK] Seq=518 Ack=5801 Win=66560 Len=0"
"24","0.134140","13.35.13.10","192.168.1.12","TLSv1.3","829","Application Data, Application Data, Application Data"
"25","0.153496","13.227.241.28","192.168.1.12","TCP","54","443  >  53705 [ACK] Seq=1 Ack=518 Win=30464 Len=0"
"26","0.153496","13.227.241.28","192.168.1.12","TLSv1.3","1506","Server Hello, Change Cipher Spec, Application Data"
"27","0.153496","13.227.241.28","192.168.1.12","TCP","1506","443  >  53705 [ACK] Seq=1453 Ack=518 Win=30464 Len=1452 [TCP segment of a reassembled PDU]"
"28","0.153496","13.227.241.28","192.168.1.12","TCP","1506","443  >  53705 [ACK] Seq=2905 Ack=518 Win=30464 Len=1452 [TCP segment of a reassembled PDU]"
"29","0.153496","13.227.241.28","192.168.1.12","TLSv1.3","1506","Application Data [TCP segment of a reassembled PDU]"
"30","0.153496","13.227.241.28","192.168.1.12","TLSv1.3","117","Application Data, Application Data"
"31","0.153985","192.168.1.12","13.227.241.28","TCP","54","53705  >  443 [ACK] Seq=518 Ack=5872 Win=66560 Len=0"
"32","0.175640","192.168.1.12","13.35.13.10","TCP","54","53704  >  443 [ACK] Seq=518 Ack=6576 Win=65792 Len=0"
"33","0.181856","192.168.1.12","13.227.241.28","TLSv1.3","118","Change Cipher Spec, Application Data"
"34","0.186367","192.168.1.12","13.35.13.10","TLSv1.3","118","Change Cipher Spec, Application Data"
"35","0.190699","192.168.1.12","13.227.241.28","TLSv1.3","491","Application Data"
"36","0.192422","192.168.1.12","13.35.13.10","TLSv1.3","894","Application Data"
"37","0.196596","13.227.241.28","192.168.1.12","TCP","56","443  >  53705 [ACK] Seq=5872 Ack=582 Win=30464 Len=0"
"38","0.197600","13.227.241.28","192.168.1.12","TLSv1.3","116","Application Data"
"39","0.198896","192.168.1.12","13.227.241.28","TLSv1.3","85","Application Data"
"40","0.204720","13.35.13.10","192.168.1.12","TCP","56","443  >  53704 [ACK] Seq=6576 Ack=582 Win=30464 Len=0"
"41","0.204720","13.35.13.10","192.168.1.12","TLSv1.3","116","Application Data"
"42","0.207231","192.168.1.12","13.35.13.10","TLSv1.3","85","Application Data"
"43","0.208735","13.227.241.28","192.168.1.12","TLSv1.3","85","Application Data"
"44","0.208735","13.227.241.28","192.168.1.12","TCP","1506","443  >  53705 [ACK] Seq=5965 Ack=1019 Win=31488 Len=1452 [TCP segment of a reassembled PDU]"
"45","0.208735","13.227.241.28","192.168.1.12","TCP","1506","443  >  53705 [ACK] Seq=7417 Ack=1019 Win=31488 Len=1452 [TCP segment of a reassembled PDU]"
"46","0.208735","13.227.241.28","192.168.1.12","TCP","1506","443  >  53705 [ACK] Seq=8869 Ack=1019 Win=31488 Len=1452 [TCP segment of a reassembled PDU]"
"47","0.208735","13.227.241.28","192.168.1.12","TCP","1506","443  >  53705 [ACK] Seq=10321 Ack=1019 Win=31488 Len=1452 [TCP segment of a reassembled PDU]"
"48","0.208735","13.227.241.28","192.168.1.12","TCP","1506","443  >  53705 [ACK] Seq=11773 Ack=1019 Win=31488 Len=1452 [TCP segment of a reassembled PDU]"
"49","0.208735","13.227.241.28","192.168.1.12","TCP","1506","443  >  53705 [ACK] Seq=13225 Ack=1019 Win=31488 Len=1452 [TCP segment of a reassembled PDU]"
"50","0.209194","192.168.1.12","13.227.241.28","TCP","54","53705  >  443 [ACK] Seq=1050 Ack=14677 Win=66560 Len=0"
"51","0.210302","13.227.241.28","192.168.1.12","TCP","1506","443  >  53705 [ACK] Seq=14677 Ack=1019 Win=31488 Len=1452 [TCP segment of a reassembled PDU]"
"52","0.210302","13.227.241.28","192.168.1.12","TCP","1506","443  >  53705 [ACK] Seq=16129 Ack=1019 Win=31488 Len=1452 [TCP segment of a reassembled PDU]"
"53","0.210302","13.227.241.28","192.168.1.12","TCP","1506","443  >  53705 [ACK] Seq=17581 Ack=1019 Win=31488 Len=1452 [TCP segment of a reassembled PDU]"
"54","0.210302","13.227.241.28","192.168.1.12","TCP","1506","443  >  53705 [ACK] Seq=19033 Ack=1019 Win=31488 Len=1452 [TCP segment of a reassembled PDU]"
"55","0.210626","192.168.1.12","13.227.241.28","TCP","54","53705  >  443 [ACK] Seq=1050 Ack=20485 Win=66560 Len=0"
"56","0.215635","13.227.241.28","192.168.1.12","TCP","1506","443  >  53705 [ACK] Seq=20485 Ack=1019 Win=31488 Len=1452 [TCP segment of a reassembled PDU]"
"57","0.215635","13.227.241.28","192.168.1.12","TLSv1.3","1506","Application Data [TCP segment of a reassembled PDU]"
"58","0.215635","13.35.13.10","192.168.1.12","TLSv1.3","85","Application Data"
"59","0.215635","13.227.241.28","192.168.1.12","TCP","1506","443  >  53705 [ACK] Seq=23389 Ack=1019 Win=31488 Len=1452 [TCP segment of a reassembled PDU]"
"60","0.215635","13.227.241.28","192.168.1.12","TCP","1506","443  >  53705 [ACK] Seq=24841 Ack=1019 Win=31488 Len=1452 [TCP segment of a reassembled PDU]"
"61","0.216086","192.168.1.12","13.227.241.28","TCP","54","53705  >  443 [ACK] Seq=1050 Ack=26293 Win=66560 Len=0"
"62","0.217830","13.227.241.28","192.168.1.12","TCP","1506","443  >  53705 [ACK] Seq=26293 Ack=1019 Win=31488 Len=1452 [TCP segment of a reassembled PDU]"
"63","0.217830","13.227.241.28","192.168.1.12","TCP","1506","443  >  53705 [ACK] Seq=27745 Ack=1019 Win=31488 Len=1452 [TCP segment of a reassembled PDU]"
"64","0.217830","13.35.13.10","192.168.1.12","TLSv1.3","528","Application Data"
"65","0.217830","13.227.241.28","192.168.1.12","TCP","1506","443  >  53705 [ACK] Seq=29197 Ack=1019 Win=31488 Len=1452 [TCP segment of a reassembled PDU]"
"66","0.217830","13.227.241.28","192.168.1.12","TCP","1506","443  >  53705 [ACK] Seq=30649 Ack=1019 Win=31488 Len=1452 [TCP segment of a reassembled PDU]"
"67","0.217830","13.227.241.28","192.168.1.12","TCP","1506","443  >  53705 [ACK] Seq=32101 Ack=1019 Win=31488 Len=1452 [TCP segment of a reassembled PDU]"
"68","0.217830","13.227.241.28","192.168.1.12","TCP","1506","443  >  53705 [ACK] Seq=33553 Ack=1019 Win=31488 Len=1452 [TCP segment of a reassembled PDU]"
"69","0.217830","13.227.241.28","192.168.1.12","TCP","1506","443  >  53705 [ACK] Seq=35005 Ack=1050 Win=31488 Len=1452 [TCP segment of a reassembled PDU]"
"70","0.217830","13.227.241.28","192.168.1.12","TCP","1506","443  >  53705 [ACK] Seq=36457 Ack=1050 Win=31488 Len=1452 [TCP segment of a reassembled PDU]"
"71","0.218508","192.168.1.12","13.227.241.28","TCP","54","53705  >  443 [ACK] Seq=1050 Ack=37909 Win=66560 Len=0"
"72","0.218619","192.168.1.12","13.35.13.10","TCP","54","53704  >  443 [ACK] Seq=1453 Ack=7143 Win=65280 Len=0"
"73","0.221057","13.227.241.28","192.168.1.12","TLSv1.3","1506","Application Data [TCP segment of a reassembled PDU]"
"74","0.221057","13.227.241.28","192.168.1.12","TCP","1506","443  >  53705 [ACK] Seq=39361 Ack=1050 Win=31488 Len=1452 [TCP segment of a reassembled PDU]"
"75","0.221057","13.227.241.28","192.168.1.12","TCP","1506","443  >  53705 [ACK] Seq=40813 Ack=1050 Win=31488 Len=1452 [TCP segment of a reassembled PDU]"
"76","0.221057","13.227.241.28","192.168.1.12","TCP","1506","443  >  53705 [ACK] Seq=42265 Ack=1050 Win=31488 Len=1452 [TCP segment of a reassembled PDU]"
"77","0.221057","13.227.241.28","192.168.1.12","TCP","1506","443  >  53705 [ACK] Seq=43717 Ack=1050 Win=31488 Len=1452 [TCP segment of a reassembled PDU]"
"78","0.221057","13.227.241.28","192.168.1.12","TCP","1506","443  >  53705 [ACK] Seq=45169 Ack=1050 Win=31488 Len=1452 [TCP segment of a reassembled PDU]"
"79","0.221435","192.168.1.12","13.227.241.28","TCP","54","53705  >  443 [ACK] Seq=1050 Ack=46621 Win=66560 Len=0"
"80","0.222983","13.227.241.28","192.168.1.12","TCP","1506","443  >  53705 [ACK] Seq=46621 Ack=1050 Win=31488 Len=1452 [TCP segment of a reassembled PDU]"
"81","0.222983","13.227.241.28","192.168.1.12","TCP","1506","443  >  53705 [ACK] Seq=48073 Ack=1050 Win=31488 Len=1452 [TCP segment of a reassembled PDU]"
"82","0.223257","192.168.1.12","13.227.241.28","TCP","54","53705  >  443 [ACK] Seq=1050 Ack=49525 Win=66560 Len=0"
"83","0.228976","13.227.241.28","192.168.1.12","TCP","1506","443  >  53705 [ACK] Seq=49525 Ack=1050 Win=31488 Len=1452 [TCP segment of a reassembled PDU]"
"84","0.228976","13.227.241.28","192.168.1.12","TCP","1506","443  >  53705 [ACK] Seq=50977 Ack=1050 Win=31488 Len=1452 [TCP segment of a reassembled PDU]"
"85","0.229237","192.168.1.12","13.227.241.28","TCP","54","53705  >  443 [ACK] Seq=1050 Ack=52429 Win=66560 Len=0"
"86","0.229585","13.227.241.28","192.168.1.12","TCP","1506","443  >  53705 [ACK] Seq=52429 Ack=1050 Win=31488 Len=1452 [TCP segment of a reassembled PDU]"
"87","0.229585","13.227.241.28","192.168.1.12","TLSv1.3","1506","Application Data [TCP segment of a reassembled PDU]"
"88","0.229774","192.168.1.12","13.227.241.28","TCP","54","53705  >  443 [ACK] Seq=1050 Ack=55333 Win=66560 Len=0"
"89","0.230094","13.227.241.28","192.168.1.12","TCP","1506","443  >  53705 [ACK] Seq=55333 Ack=1050 Win=31488 Len=1452 [TCP segment of a reassembled PDU]"
"90","0.230094","13.227.241.28","192.168.1.12","TCP","1506","443  >  53705 [ACK] Seq=56785 Ack=1050 Win=31488 Len=1452 [TCP segment of a reassembled PDU]"
"91","0.230290","192.168.1.12","13.227.241.28","TCP","54","53705  >  443 [ACK] Seq=1050 Ack=58237 Win=66560 Len=0"
"92","0.233116","13.227.241.28","192.168.1.12","TCP","1506","443  >  53705 [ACK] Seq=58237 Ack=1050 Win=31488 Len=1452 [TCP segment of a reassembled PDU]"
"93","0.233116","13.227.241.28","192.168.1.12","TCP","1506","443  >  53705 [ACK] Seq=59689 Ack=1050 Win=31488 Len=1452 [TCP segment of a reassembled PDU]"
"94","0.233399","192.168.1.12","13.227.241.28","TCP","54","53705  >  443 [ACK] Seq=1050 Ack=61141 Win=66560 Len=0"
"95","0.233678","13.227.241.28","192.168.1.12","TCP","1506","443  >  53705 [ACK] Seq=61141 Ack=1050 Win=31488 Len=1452 [TCP segment of a reassembled PDU]"
"96","0.233678","13.227.241.28","192.168.1.12","TCP","1506","443  >  53705 [ACK] Seq=62593 Ack=1050 Win=31488 Len=1452 [TCP segment of a reassembled PDU]"
"97","0.233678","13.227.241.28","192.168.1.12","TCP","1506","443  >  53705 [ACK] Seq=64045 Ack=1050 Win=31488 Len=1452 [TCP segment of a reassembled PDU]"
"98","0.233678","13.227.241.28","192.168.1.12","TCP","1506","443  >  53705 [ACK] Seq=65497 Ack=1050 Win=31488 Len=1452 [TCP segment of a reassembled PDU]"
"99","0.233950","192.168.1.12","13.227.241.28","TCP","54","53705  >  443 [ACK] Seq=1050 Ack=66949 Win=66560 Len=0"
"100","0.238186","13.227.241.28","192.168.1.12","TCP","1506","443  >  53705 [ACK] Seq=66949 Ack=1050 Win=31488 Len=1452 [TCP segment of a reassembled PDU]"
"101","0.238186","13.227.241.28","192.168.1.12","TCP","1506","443  >  53705 [ACK] Seq=68401 Ack=1050 Win=31488 Len=1452 [TCP segment of a reassembled PDU]"
"102","0.238186","13.227.241.28","192.168.1.12","TLSv1.3","1506","Application Data [TCP segment of a reassembled PDU]"
"103","0.238186","13.227.241.28","192.168.1.12","TCP","1506","443  >  53705 [ACK] Seq=71305 Ack=1050 Win=31488 Len=1452 [TCP segment of a reassembled PDU]"
"104","0.238186","13.227.241.28","192.168.1.12","TCP","1506","443  >  53705 [ACK] Seq=72757 Ack=1050 Win=31488 Len=1452 [TCP segment of a reassembled PDU]"
"105","0.238186","13.227.241.28","192.168.1.12","TCP","1506","443  >  53705 [ACK] Seq=74209 Ack=1050 Win=31488 Len=1452 [TCP segment of a reassembled PDU]"
"106","0.238186","13.227.241.28","192.168.1.12","TCP","1506","443  >  53705 [ACK] Seq=75661 Ack=1050 Win=31488 Len=1452 [TCP segment of a reassembled PDU]"
"107","0.238694","192.168.1.12","13.227.241.28","TCP","54","53705  >  443 [ACK] Seq=1050 Ack=77113 Win=66560 Len=0"
"108","0.239144","13.227.241.28","192.168.1.12","TCP","1506","443  >  53705 [ACK] Seq=77113 Ack=1050 Win=31488 Len=1452 [TCP segment of a reassembled PDU]"
"109","0.239144","13.227.241.28","192.168.1.12","TLSv1.3","433","Application Data, Application Data"
"110","0.239355","192.168.1.12","13.227.241.28","TCP","54","53705  >  443 [ACK] Seq=1050 Ack=78944 Win=66560 Len=0"
"111","0.255461","192.168.1.12","13.35.13.10","TLSv1.3","824","Application Data"
"112","0.274568","13.35.13.10","192.168.1.12","TCP","56","443  >  53704 [ACK] Seq=7143 Ack=1453 Win=32000 Len=0"
"113","0.275566","13.35.13.10","192.168.1.12","TCP","56","443  >  53704 [ACK] Seq=7143 Ack=2223 Win=33792 Len=0"
"114","0.276551","13.35.13.10","192.168.1.12","TLSv1.3","526","Application Data"
"115","0.316977","192.168.1.12","13.35.13.10","TCP","54","53704  >  443 [ACK] Seq=2223 Ack=7615 Win=66560 Len=0"
"116","0.427652","192.168.1.12","209.58.188.181","TCP","66","53706  >  443 [SYN] Seq=0 Win=64240 Len=0 MSS=1460 WS=256 SACK_PERM=1"
"117","0.443732","192.168.1.12","13.35.13.10","TLSv1.3","831","Application Data"
"118","0.464872","192.168.1.12","13.35.13.10","TLSv1.3","825","Application Data"
"119","0.466025","192.168.1.12","18.141.80.142","TCP","66","53707  >  443 [SYN] Seq=0 Win=64240 Len=0 MSS=1460 WS=256 SACK_PERM=1"
"120","0.470136","13.35.13.10","192.168.1.12","TLSv1.3","528","Application Data"
"122","0.495172","13.35.13.10","192.168.1.12","TLSv1.3","527","Application Data"
"124","0.495172","209.58.188.181","192.168.1.12","TCP","66","443  >  53706 [SYN, ACK] Seq=0 Ack=1 Win=29200 Len=0 MSS=1452 SACK_PERM=1 WS=512"
"125","0.495172","18.141.80.142","192.168.1.12","TCP","66","443  >  53707 [SYN, ACK] Seq=0 Ack=1 Win=26883 Len=0 MSS=1452 SACK_PERM=1 WS=256"
"126","0.495870","192.168.1.12","13.35.13.10","TCP","54","53704  >  443 [ACK] Seq=3771 Ack=8562 Win=65792 Len=0"
"127","0.496071","192.168.1.12","209.58.188.181","TCP","54","53706  >  443 [ACK] Seq=1 Ack=1 Win=66560 Len=0"
"128","0.496220","192.168.1.12","18.141.80.142","TCP","54","53707  >  443 [ACK] Seq=1 Ack=1 Win=66560 Len=0"
"129","0.498998","192.168.1.12","18.141.80.142","TLSv1.2","571","Client Hello"
"130","0.501547","192.168.1.12","103.71.26.125","TCP","66","53708  >  443 [SYN] Seq=0 Win=64240 Len=0 MSS=1460 WS=256 SACK_PERM=1"
"131","0.513062","192.168.1.12","209.58.188.181","TLSv1.2","571","Client Hello"
"132","0.525573","103.71.26.125","192.168.1.12","TCP","62","443  >  53708 [SYN, ACK] Seq=0 Ack=1 Win=14520 Len=0 MSS=1452 SACK_PERM=1"
"133","0.525573","18.141.80.142","192.168.1.12","TLSv1.2","1506","Server Hello"
"134","0.525573","18.141.80.142","192.168.1.12","TLSv1.2","1506","Certificate [TCP segment of a reassembled PDU]"
"135","0.525573","18.141.80.142","192.168.1.12","TLSv1.2","123","Server Key Exchange, Server Hello Done"
"136","0.526132","192.168.1.12","103.71.26.125","TCP","54","53708  >  443 [ACK] Seq=1 Ack=1 Win=64240 Len=0"
"137","0.526322","192.168.1.12","18.141.80.142","TCP","54","53707  >  443 [ACK] Seq=518 Ack=2974 Win=66560 Len=0"
"138","0.527679","192.168.1.12","103.71.26.125","TLSv1.2","571","Client Hello"
"139","0.556941","103.71.26.125","192.168.1.12","TCP","54","443  >  53708 [ACK] Seq=1 Ack=518 Win=15037 Len=0"
"140","0.556941","103.71.26.125","192.168.1.12","TLSv1.2","1506","Server Hello"
"141","0.556941","103.71.26.125","192.168.1.12","TCP","1506","443  >  53708 [ACK] Seq=1453 Ack=518 Win=15037 Len=1452 [TCP segment of a reassembled PDU]"
"142","0.556941","103.71.26.125","192.168.1.12","TLSv1.2","468","Certificate, Server Key Exchange, Server Hello Done"
"143","0.557295","192.168.1.12","103.71.26.125","TCP","54","53708  >  443 [ACK] Seq=518 Ack=3319 Win=65340 Len=0"
"144","0.580975","209.58.188.181","192.168.1.12","TLSv1.2","1506","Server Hello"
"145","0.580975","209.58.188.181","192.168.1.12","TCP","1506","443  >  53706 [ACK] Seq=1453 Ack=518 Win=30720 Len=1452 [TCP segment of a reassembled PDU]"
"146","0.580975","209.58.188.181","192.168.1.12","TCP","1506","443  >  53706 [ACK] Seq=2905 Ack=518 Win=30720 Len=1452 [TCP segment of a reassembled PDU]"
"147","0.580975","209.58.188.181","192.168.1.12","TLSv1.2","1506","Certificate [TCP segment of a reassembled PDU]"
"148","0.580975","209.58.188.181","192.168.1.12","TLSv1.2","393","Server Key Exchange, Server Hello Done"
"149","0.581376","192.168.1.12","209.58.188.181","TCP","54","53706  >  443 [ACK] Seq=518 Ack=6148 Win=66560 Len=0"
"150","0.781255","192.168.1.12","209.58.188.181","TLSv1.2","180","Client Key Exchange, Change Cipher Spec, Encrypted Handshake Message"
"151","0.808985","192.168.1.12","18.141.80.142","TLSv1.2","180","Client Key Exchange, Change Cipher Spec, Encrypted Handshake Message"
"152","0.843659","18.141.80.142","192.168.1.12","TLSv1.2","296","New Session Ticket, Change Cipher Spec, Encrypted Handshake Message"
"153","0.843659","209.58.188.181","192.168.1.12","TLSv1.2","296","New Session Ticket, Change Cipher Spec, Encrypted Handshake Message"
"154","0.850296","192.168.1.12","18.141.80.142","TLSv1.2","600","Application Data"
"155","0.850624","192.168.1.12","209.58.188.181","TLSv1.2","886","Application Data"
"158","0.877198","18.141.80.142","192.168.1.12","TLSv1.2","1019","Application Data"
"163","0.925800","192.168.1.12","103.71.26.125","TLSv1.2","180","Client Key Exchange, Change Cipher Spec, Encrypted Handshake Message"
"166","0.944540","103.71.26.125","192.168.1.12","TCP","56","443  >  53708 [ACK] Seq=3319 Ack=644 Win=15163 Len=0"
"167","0.945643","103.71.26.125","192.168.1.12","TLSv1.2","60","Change Cipher Spec"
"168","0.945643","103.71.26.125","192.168.1.12","TLSv1.2","99","Encrypted Handshake Message"
"169","0.945872","192.168.1.12","103.71.26.125","TCP","54","53708  >  443 [ACK] Seq=644 Ack=3370 Win=65289 Len=0"
"171","0.952231","209.58.188.181","192.168.1.12","TCP","56","443  >  53706 [ACK] Seq=6390 Ack=1476 Win=32256 Len=0"
"172","0.955287","192.168.1.12","18.141.80.142","TCP","54","53707  >  443 [ACK] Seq=1190 Ack=4181 Win=65536 Len=0"
"173","0.966354","192.168.1.12","103.71.26.125","TLSv1.2","660","Application Data"
"176","0.986489","103.71.26.125","192.168.1.12","TCP","56","443  >  53708 [ACK] Seq=3370 Ack=1250 Win=15769 Len=0"
"177","0.988216","103.71.26.125","192.168.1.12","TLSv1.2","934","Application Data"
"188","1.073066","192.168.1.12","103.71.26.125","TCP","54","53708  >  443 [ACK] Seq=1250 Ack=4250 Win=64409 Len=0"
"189","1.074654","192.168.1.12","74.125.200.132","TCP","66","53709  >  443 [SYN] Seq=0 Win=64240 Len=0 MSS=1460 WS=256 SACK_PERM=1"
"190","1.075776","192.168.1.12","13.35.13.85","TLSv1.2","214","Application Data"
"191","1.093832","74.125.200.132","192.168.1.12","TCP","66","443  >  53709 [SYN, ACK] Seq=0 Ack=1 Win=65535 Len=0 MSS=1430 SACK_PERM=1 WS=256"
"192","1.094115","192.168.1.12","74.125.200.132","TCP","54","53709  >  443 [ACK] Seq=1 Ack=1 Win=65536 Len=0"
"193","1.096782","13.35.13.85","192.168.1.12","TCP","1504","443  >  53700 [ACK] Seq=1 Ack=161 Win=127 Len=1450 [TCP segment of a reassembled PDU]"
"194","1.096782","13.35.13.85","192.168.1.12","TLSv1.2","104","Application Data"
"195","1.096782","13.35.13.85","192.168.1.12","TLSv1.2","85","Application Data"
"196","1.097143","192.168.1.12","13.35.13.85","TCP","54","53700  >  443 [ACK] Seq=161 Ack=1532 Win=260 Len=0"
"197","1.097859","192.168.1.12","74.125.200.132","TLSv1.3","571","Client Hello"
"199","1.117863","74.125.200.132","192.168.1.12","TCP","54","443  >  53709 [ACK] Seq=1 Ack=518 Win=66816 Len=0"
"200","1.118881","74.125.200.132","192.168.1.12","TLSv1.3","1484","Server Hello, Change Cipher Spec"
"201","1.118881","74.125.200.132","192.168.1.12","TCP","1484","443  >  53709 [ACK] Seq=1431 Ack=518 Win=66816 Len=1430 [TCP segment of a reassembled PDU]"
"202","1.118881","74.125.200.132","192.168.1.12","TLSv1.3","73","Application Data"
"203","1.119181","192.168.1.12","74.125.200.132","TCP","54","53709  >  443 [ACK] Seq=518 Ack=2880 Win=65536 Len=0"
"204","1.148008","192.168.1.12","74.125.200.132","TLSv1.3","118","Change Cipher Spec, Application Data"
"205","1.151711","192.168.1.12","74.125.200.132","TLSv1.3","582","Application Data"
"206","1.166238","74.125.200.132","192.168.1.12","TLSv1.3","634","Application Data, Application Data"
"207","1.167703","192.168.1.12","74.125.200.132","TLSv1.3","85","Application Data"
"208","1.171807","74.125.200.132","192.168.1.12","TLSv1.3","85","Application Data"
"209","1.172788","74.125.200.132","192.168.1.12","TLSv1.3","472","Application Data"
"210","1.172999","192.168.1.12","74.125.200.132","TCP","54","53709  >  443 [ACK] Seq=1141 Ack=3909 Win=64512 Len=0"
"211","1.174282","74.125.200.132","192.168.1.12","TLSv1.3","1484","Application Data"
"212","1.174282","74.125.200.132","192.168.1.12","TLSv1.3","1484","Application Data"
"213","1.174282","74.125.200.132","192.168.1.12","TLSv1.3","273","Application Data, Application Data"
"214","1.174282","74.125.200.132","192.168.1.12","TLSv1.3","93","Application Data"
"215","1.174613","192.168.1.12","74.125.200.132","TCP","54","53709  >  443 [ACK] Seq=1141 Ack=7027 Win=65536 Len=0"
"216","1.191265","74.125.200.132","192.168.1.12","TCP","56","443  >  53709 [ACK] Seq=7027 Ack=1141 Win=67840 Len=0"
"217","1.208936","192.168.1.12","74.125.200.132","TLSv1.3","106","Application Data"
"218","1.226893","74.125.200.132","192.168.1.12","TCP","56","443  >  53709 [ACK] Seq=7027 Ack=1193 Win=67840 Len=0"
"235","1.377350","192.168.1.12","104.111.10.101","TCP","66","53710  >  443 [SYN] Seq=0 Win=64240 Len=0 MSS=1460 WS=256 SACK_PERM=1"
"236","1.378375","192.168.1.12","13.227.241.78","TCP","66","53711  >  443 [SYN] Seq=0 Win=64240 Len=0 MSS=1460 WS=256 SACK_PERM=1"
"239","1.394996","104.111.10.101","192.168.1.12","TCP","66","443  >  53710 [SYN, ACK] Seq=0 Ack=1 Win=29200 Len=0 MSS=1452 SACK_PERM=1 WS=128"
"240","1.395451","192.168.1.12","104.111.10.101","TCP","54","53710  >  443 [ACK] Seq=1 Ack=1 Win=66560 Len=0"
"242","1.396904","192.168.1.12","18.138.174.219","TCP","66","53712  >  443 [SYN] Seq=0 Win=64240 Len=0 MSS=1460 WS=256 SACK_PERM=1"
"243","1.397042","192.168.1.12","104.111.10.101","TLSv1.3","674","Client Hello"
"244","1.397948","13.227.241.78","192.168.1.12","TCP","66","443  >  53711 [SYN, ACK] Seq=0 Ack=1 Win=29200 Len=0 MSS=1452 SACK_PERM=1 WS=256"
"245","1.398314","192.168.1.12","13.227.241.78","TCP","54","53711  >  443 [ACK] Seq=1 Ack=1 Win=66560 Len=0"
"246","1.399858","192.168.1.12","13.227.241.78","TLSv1.3","571","Client Hello"
"250","1.420371","18.138.174.219","192.168.1.12","TCP","58","443  >  53712 [SYN, ACK] Seq=0 Ack=1 Win=26883 Len=0 MSS=1452"
"251","1.420371","104.111.10.101","192.168.1.12","TCP","54","443  >  53710 [ACK] Seq=1 Ack=621 Win=30464 Len=0"
"252","1.420811","192.168.1.12","18.138.174.219","TCP","54","53712  >  443 [ACK] Seq=1 Ack=1 Win=64240 Len=0"
"254","1.421852","104.111.10.101","192.168.1.12","TLSv1.3","324","Server Hello, Change Cipher Spec, Application Data, Application Data"
"255","1.423246","13.227.241.78","192.168.1.12","TCP","54","443  >  53711 [ACK] Seq=1 Ack=518 Win=30464 Len=0"
"256","1.423246","13.227.241.78","192.168.1.12","TLSv1.3","1506","Server Hello, Change Cipher Spec, Application Data"
"257","1.423246","13.227.241.78","192.168.1.12","TCP","1506","443  >  53711 [ACK] Seq=1453 Ack=518 Win=30464 Len=1452 [TCP segment of a reassembled PDU]"
"258","1.423477","192.168.1.12","18.138.174.219","TLSv1.2","571","Client Hello"
"259","1.423540","192.168.1.12","13.227.241.78","TCP","54","53711  >  443 [ACK] Seq=518 Ack=2905 Win=66560 Len=0"
"260","1.424020","13.227.241.78","192.168.1.12","TCP","1506","443  >  53711 [ACK] Seq=2905 Ack=518 Win=30464 Len=1452 [TCP segment of a reassembled PDU]"
"261","1.426154","13.227.241.78","192.168.1.12","TLSv1.3","1506","Application Data [TCP segment of a reassembled PDU]"
"262","1.426154","13.227.241.78","192.168.1.12","TLSv1.3","131","Application Data, Application Data"
"264","1.426385","192.168.1.12","13.227.241.78","TCP","54","53711  >  443 [ACK] Seq=518 Ack=5886 Win=66560 Len=0"
"266","1.443845","18.138.174.219","192.168.1.12","TCP","54","443  >  53712 [ACK] Seq=1 Ack=518 Win=29480 Len=0"
"267","1.446323","18.138.174.219","192.168.1.12","TLSv1.2","1494","Server Hello"
"268","1.446323","18.138.174.219","192.168.1.12","TCP","1494","443  >  53712 [ACK] Seq=1441 Ack=518 Win=29480 Len=1440 [TCP segment of a reassembled PDU]"
"269","1.446323","18.138.174.219","192.168.1.12","TCP","1270","443  >  53712 [PSH, ACK] Seq=2881 Ack=518 Win=29480 Len=1216 [TCP segment of a reassembled PDU]"
"270","1.446631","192.168.1.12","18.138.174.219","TCP","54","53712  >  443 [ACK] Seq=518 Ack=4097 Win=65340 Len=0"
"271","1.447224","18.138.174.219","192.168.1.12","TCP","1494","443  >  53712 [ACK] Seq=4097 Ack=518 Win=29480 Len=1440 [TCP segment of a reassembled PDU]"
"272","1.447224","18.138.174.219","192.168.1.12","TLSv1.2","620","Certificate, Server Key Exchange, Server Hello Done"
"273","1.447439","192.168.1.12","18.138.174.219","TCP","54","53712  >  443 [ACK] Seq=518 Ack=6103 Win=65340 Len=0"
"274","1.451775","192.168.1.12","104.111.10.101","TLSv1.3","134","Change Cipher Spec, Application Data"
"275","1.452111","192.168.1.12","104.111.10.101","TLSv1.3","999","Application Data"
"276","1.455865","192.168.1.12","13.227.241.78","TLSv1.3","118","Change Cipher Spec, Application Data"
"278","1.469545","104.111.10.101","192.168.1.12","TLSv1.3","341","Application Data"
"279","1.473209","192.168.1.12","13.227.241.78","TLSv1.3","1242","Application Data"
"280","1.473394","13.227.241.78","192.168.1.12","TCP","56","443  >  53711 [ACK] Seq=5886 Ack=582 Win=30464 Len=0"
"281","1.480542","104.111.10.101","192.168.1.12","TLSv1.3","604","Application Data"
"282","1.480795","192.168.1.12","104.111.10.101","TCP","54","53710  >  443 [ACK] Seq=1646 Ack=1108 Win=65536 Len=0"
"286","1.494438","13.227.241.78","192.168.1.12","TCP","56","443  >  53711 [ACK] Seq=5886 Ack=1770 Win=33280 Len=0"
"287","1.494438","13.227.241.78","192.168.1.12","TLSv1.3","628","Application Data"
"288","1.504715","192.168.1.12","18.138.174.219","TLSv1.2","180","Client Key Exchange, Change Cipher Spec, Encrypted Handshake Message"
"289","1.523663","18.138.174.219","192.168.1.12","TLSv1.2","105","Change Cipher Spec, Encrypted Handshake Message"
"290","1.531206","192.168.1.12","18.138.174.219","TLSv1.2","570","Application Data"
"291","1.554310","18.138.174.219","192.168.1.12","TLSv1.2","552","Application Data"
"292","1.555313","192.168.1.12","13.227.241.78","TCP","54","53711  >  443 [ACK] Seq=1770 Ack=6460 Win=66048 Len=0"
"293","1.655572","192.168.1.12","18.138.174.219","TCP","54","53712  >  443 [ACK] Seq=1160 Ack=6652 Win=64791 Len=0"
"318","1.939159","192.168.1.12","74.118.186.214","TCP","66","53698  >  443 [SYN] Seq=0 Win=64240 Len=0 MSS=1460 WS=256 SACK_PERM=1"
"322","1.996873","192.168.1.12","104.19.132.78","TLSv1.2","290","Application Data"
"323","2.000749","192.168.1.12","104.19.132.78","TLSv1.2","135","Application Data"
"326","2.016537","104.19.132.78","192.168.1.12","TCP","56","443  >  53685 [ACK] Seq=2810 Ack=237 Win=69 Len=0"
"328","2.019962","104.19.132.78","192.168.1.12","TCP","56","443  >  53685 [ACK] Seq=2810 Ack=318 Win=69 Len=0"
"342","2.085014","192.168.1.12","182.161.72.130","TLSv1.2","619","Application Data"
"345","2.127801","192.168.1.12","104.19.132.78","TLSv1.2","1251","Application Data"
"350","2.139137","182.161.72.130","192.168.1.12","TCP","56","443  >  53691 [ACK] Seq=1 Ack=566 Win=63 Len=0"
"351","2.139137","182.161.72.130","192.168.1.12","TLSv1.2","102","Application Data"
"352","2.152110","104.19.132.78","192.168.1.12","TCP","56","443  >  53685 [ACK] Seq=2810 Ack=1515 Win=71 Len=0"
"353","2.156658","104.19.132.78","192.168.1.12","TLSv1.2","1445","Application Data"
"354","2.156658","104.19.132.78","192.168.1.12","TLSv1.2","1445","Application Data"
"355","2.156969","192.168.1.12","104.19.132.78","TCP","54","53685  >  443 [ACK] Seq=1515 Ack=5592 Win=257 Len=0"
"356","2.162540","104.19.132.78","192.168.1.12","TLSv1.2","1445","Application Data"
"357","2.162540","104.19.132.78","192.168.1.12","TLSv1.2","1445","Application Data"
"358","2.162785","192.168.1.12","104.19.132.78","TCP","54","53685  >  443 [ACK] Seq=1515 Ack=8374 Win=257 Len=0"
"359","2.168239","104.19.132.78","192.168.1.12","TLSv1.2","1445","Application Data"
"360","2.172185","104.19.132.78","192.168.1.12","TLSv1.2","1506","Application Data"
"361","2.172185","104.19.132.78","192.168.1.12","TLSv1.2","1384","Application Data"
"362","2.172185","104.19.132.78","192.168.1.12","TLSv1.2","1506","Application Data"
"363","2.172185","104.19.132.78","192.168.1.12","TLSv1.2","1506","Application Data [TCP segment of a reassembled PDU]"
"364","2.172185","104.19.132.78","192.168.1.12","TLSv1.2","1323","Application Data"
"365","2.172185","104.19.132.78","192.168.1.12","TLSv1.2","1445","Application Data"
"366","2.172185","104.19.132.78","192.168.1.12","TLSv1.2","1469","Application Data, Application Data"
"367","2.172185","104.19.132.78","192.168.1.12","TLSv1.2","1445","Application Data"
"368","2.172185","104.19.132.78","192.168.1.12","TLSv1.2","1445","Application Data"
"369","2.172185","104.19.132.78","192.168.1.12","TLSv1.2","1445","Application Data"
"370","2.172185","104.19.132.78","192.168.1.12","TLSv1.2","1445","Application Data"
"371","2.172185","104.19.132.78","192.168.1.12","TLSv1.2","1506","Application Data"
"372","2.172185","104.19.132.78","192.168.1.12","TLSv1.2","203","Application Data"
"373","2.172185","104.19.132.78","192.168.1.12","TLSv1.2","85","Application Data"
"374","2.172185","104.19.132.78","192.168.1.12","TLSv1.2","1445","Application Data"
"375","2.172185","104.19.132.78","192.168.1.12","TLSv1.2","1445","Application Data"
"376","2.172185","104.19.132.78","192.168.1.12","TLSv1.2","1445","Application Data"
"377","2.172185","104.19.132.78","192.168.1.12","TLSv1.2","1445","Application Data"
"378","2.172185","104.19.132.78","192.168.1.12","TLSv1.2","1265","Application Data"
"379","2.172185","104.19.132.78","192.168.1.12","TLSv1.2","85","Application Data"
"380","2.172185","104.19.132.78","192.168.1.12","TLSv1.2","1445","Application Data"
"381","2.172185","104.19.132.78","192.168.1.12","TLSv1.2","1445","Application Data"
"382","2.172185","104.19.132.78","192.168.1.12","TLSv1.2","1445","Application Data"
"383","2.172185","104.19.132.78","192.168.1.12","TLSv1.2","1445","Application Data"
"384","2.172185","104.19.132.78","192.168.1.12","TLSv1.2","1445","Application Data"
"385","2.172185","104.19.132.78","192.168.1.12","TLSv1.2","1506","Application Data"
"386","2.172185","104.19.132.78","192.168.1.12","TLSv1.2","1384","Application Data"
"387","2.172185","104.19.132.78","192.168.1.12","TLSv1.2","111","Application Data, Application Data"
"388","2.172185","104.19.132.78","192.168.1.12","TCP","1506","443  >  53685 [ACK] Seq=43322 Ack=1515 Win=71 Len=1452 [TCP segment of a reassembled PDU]"
"389","2.172185","104.19.132.78","192.168.1.12","TCP","1506","443  >  53685 [ACK] Seq=44774 Ack=1515 Win=71 Len=1452 [TCP segment of a reassembled PDU]"
"390","2.173392","192.168.1.12","104.19.132.78","TCP","54","53685  >  443 [ACK] Seq=1515 Ack=46226 Win=257 Len=0"
"393","2.193175","104.19.132.78","192.168.1.12","TLSv1.2","1401","Application Data"
"394","2.193435","192.168.1.12","104.19.132.78","TCP","54","53685  >  443 [ACK] Seq=1515 Ack=47573 Win=251 Len=0"
"395","2.194575","104.19.132.78","192.168.1.12","TCP","1506","443  >  53685 [ACK] Seq=47573 Ack=1515 Win=71 Len=1452 [TCP segment of a reassembled PDU]"
"396","2.194575","104.19.132.78","192.168.1.12","TCP","1506","443  >  53685 [ACK] Seq=49025 Ack=1515 Win=71 Len=1452 [TCP segment of a reassembled PDU]"
"397","2.194575","104.19.132.78","192.168.1.12","TLSv1.2","1401","Application Data"
"398","2.195046","192.168.1.12","104.19.132.78","TCP","54","53685  >  443 [ACK] Seq=1515 Ack=51824 Win=257 Len=0"
"399","2.196533","104.19.132.78","192.168.1.12","TCP","1506","443  >  53685 [ACK] Seq=51824 Ack=1515 Win=71 Len=1452 [TCP segment of a reassembled PDU]"
"400","2.196533","104.19.132.78","192.168.1.12","TCP","1506","443  >  53685 [ACK] Seq=53276 Ack=1515 Win=71 Len=1452 [TCP segment of a reassembled PDU]"
"401","2.196533","104.19.132.78","192.168.1.12","TLSv1.2","1506","Application Data [TCP segment of a reassembled PDU]"
"402","2.196533","104.19.132.78","192.168.1.12","TCP","1506","443  >  53685 [ACK] Seq=56180 Ack=1515 Win=71 Len=1452 [TCP segment of a reassembled PDU]"
"403","2.196533","104.19.132.78","192.168.1.12","TCP","1506","443  >  53685 [ACK] Seq=57632 Ack=1515 Win=71 Len=1452 [TCP segment of a reassembled PDU]"
"404","2.196533","104.19.132.78","192.168.1.12","TLSv1.2","1296","Application Data"
"405","2.196533","104.19.132.78","192.168.1.12","TCP","1506","443  >  53685 [ACK] Seq=60326 Ack=1515 Win=71 Len=1452 [TCP segment of a reassembled PDU]"
"406","2.196533","104.19.132.78","192.168.1.12","TCP","1506","443  >  53685 [ACK] Seq=61778 Ack=1515 Win=71 Len=1452 [TCP segment of a reassembled PDU]"
"407","2.196533","104.19.132.78","192.168.1.12","TLSv1.2","1506","Application Data [TCP segment of a reassembled PDU]"
"408","2.196533","104.19.132.78","192.168.1.12","TCP","1506","443  >  53685 [ACK] Seq=64682 Ack=1515 Win=71 Len=1452 [TCP segment of a reassembled PDU]"
"409","2.197114","192.168.1.12","104.19.132.78","TCP","54","53685  >  443 [ACK] Seq=1515 Ack=66134 Win=257 Len=0"
"410","2.197810","104.19.132.78","192.168.1.12","TCP","1506","443  >  53685 [ACK] Seq=66134 Ack=1515 Win=71 Len=1452 [TCP segment of a reassembled PDU]"
"411","2.197810","104.19.132.78","192.168.1.12","TCP","1070","443  >  53685 [PSH, ACK] Seq=67586 Ack=1515 Win=71 Len=1016 [TCP segment of a reassembled PDU]"
"412","2.197810","182.161.72.130","192.168.1.12","TLSv1.2","220","Application Data"
"413","2.197810","104.19.132.78","192.168.1.12","TLSv1.2","1506","Application Data [TCP segment of a reassembled PDU]"
"414","2.197810","104.19.132.78","192.168.1.12","TCP","1384","443  >  53685 [PSH, ACK] Seq=70054 Ack=1515 Win=71 Len=1330 [TCP segment of a reassembled PDU]"
"415","2.197810","104.19.132.78","192.168.1.12","TCP","1506","443  >  53685 [ACK] Seq=71384 Ack=1515 Win=71 Len=1452 [TCP segment of a reassembled PDU]"
"416","2.197810","104.19.132.78","192.168.1.12","TLSv1.2","1384","Application Data, Application Data"
"418","2.198257","192.168.1.12","104.19.132.78","TCP","54","53685  >  443 [ACK] Seq=1515 Ack=74166 Win=257 Len=0"
"419","2.198353","192.168.1.12","182.161.72.130","TCP","54","53691  >  443 [ACK] Seq=566 Ack=215 Win=256 Len=0"
"421","2.210098","104.19.132.78","192.168.1.12","TCP","1506","443  >  53685 [ACK] Seq=74166 Ack=1515 Win=71 Len=1452 [TCP segment of a reassembled PDU]"
"422","2.210098","104.19.132.78","192.168.1.12","TCP","1506","443  >  53685 [ACK] Seq=75618 Ack=1515 Win=71 Len=1452 [TCP segment of a reassembled PDU]"
"423","2.210098","104.19.132.78","192.168.1.12","TLSv1.2","158","Application Data, Application Data"
"424","2.210391","192.168.1.12","104.19.132.78","TCP","54","53685  >  443 [ACK] Seq=1515 Ack=77174 Win=257 Len=0"
"425","2.224978","192.168.1.12","18.138.174.219","TLSv1.2","586","Application Data"
"426","2.231195","104.19.132.78","192.168.1.12","TLSv1.2","514","Application Data"
"427","2.231195","104.19.132.78","192.168.1.12","TLSv1.2","85","Application Data"
"428","2.231484","192.168.1.12","104.19.132.78","TCP","54","53685  >  443 [ACK] Seq=1515 Ack=77665 Win=255 Len=0"
"429","2.248912","18.138.174.219","192.168.1.12","TLSv1.2","403","Application Data"
"430","2.258471","104.19.132.78","192.168.1.12","TLSv1.2","362","Application Data"
"431","2.258471","104.19.132.78","192.168.1.12","TLSv1.2","85","Application Data"
"432","2.258744","192.168.1.12","104.19.132.78","TCP","54","53685  >  443 [ACK] Seq=1515 Ack=78004 Win=253 Len=0"
"433","2.263162","192.168.1.12","151.101.9.44","TCP","66","53713  >  443 [SYN] Seq=0 Win=64240 Len=0 MSS=1460 WS=256 SACK_PERM=1"
"434","2.267816","192.168.1.12","18.138.174.219","TLSv1.2","566","Application Data"
"436","2.276227","192.168.1.12","35.195.81.176","TCP","66","53714  >  443 [SYN] Seq=0 Win=64240 Len=0 MSS=1460 WS=256 SACK_PERM=1"
"437","2.281677","151.101.9.44","192.168.1.12","TCP","66","443  >  53713 [SYN, ACK] Seq=0 Ack=1 Win=29200 Len=0 MSS=1452 SACK_PERM=1 WS=512"
"438","2.282102","192.168.1.12","151.101.9.44","TCP","54","53713  >  443 [ACK] Seq=1 Ack=1 Win=66560 Len=0"
"440","2.299172","18.138.174.219","192.168.1.12","TLSv1.2","538","Application Data"
"441","2.300667","192.168.1.12","151.101.9.44","TLSv1.3","574","Client Hello"
"442","2.305965","192.168.1.12","205.180.87.172","TCP","66","53715  >  443 [SYN] Seq=0 Win=64240 Len=0 MSS=1460 WS=256 SACK_PERM=1"
"443","2.325037","151.101.9.44","192.168.1.12","TCP","54","443  >  53713 [ACK] Seq=1 Ack=521 Win=30720 Len=0"
"444","2.325037","151.101.9.44","192.168.1.12","TLSv1.3","499","Server Hello, Change Cipher Spec, Application Data, Application Data, Application Data"
"445","2.335039","192.168.1.12","151.101.9.44","TLSv1.3","118","Change Cipher Spec, Application Data"
"446","2.340513","192.168.1.12","151.101.9.44","TLSv1.3","437","Application Data"
"447","2.355729","192.168.1.12","18.138.174.219","TCP","54","53712  >  443 [ACK] Seq=2204 Ack=7485 Win=63958 Len=0"
"448","2.374860","151.101.9.44","192.168.1.12","TCP","56","443  >  53713 [ACK] Seq=446 Ack=968 Win=31744 Len=0"
"449","2.374860","151.101.9.44","192.168.1.12","TLSv1.3","113","Application Data"
"450","2.374860","151.101.9.44","192.168.1.12","TLSv1.3","266","Application Data"
"451","2.375175","192.168.1.12","151.101.9.44","TCP","54","53713  >  443 [ACK] Seq=968 Ack=717 Win=66048 Len=0"
"452","2.392429","192.168.1.12","151.101.9.44","TLSv1.3","85","Application Data"
"456","2.453722","151.101.9.44","192.168.1.12","TCP","56","443  >  53713 [ACK] Seq=717 Ack=999 Win=31744 Len=0"
"463","2.519963","192.168.1.12","205.180.87.172","TCP","66","53716  >  443 [SYN] Seq=0 Win=64240 Len=0 MSS=1460 WS=256 SACK_PERM=1"
"468","2.526748","192.168.1.12","35.195.81.176","TCP","66","53717  >  443 [SYN] Seq=0 Win=64240 Len=0 MSS=1460 WS=256 SACK_PERM=1"
"472","2.569167","205.180.87.172","192.168.1.12","TCP","62","443  >  53715 [SYN, ACK] Seq=0 Ack=1 Win=29200 Len=0 MSS=1452 WS=512"
"473","2.569677","192.168.1.12","205.180.87.172","TCP","54","53715  >  443 [ACK] Seq=1 Ack=1 Win=66560 Len=0"
